course_name,grade,course_type,credit,description,learning_goals,assessment,units,final_assessments,total_hours,course_code,prerequisite,specific_expectations
Principles of Mathematics,9,Academic,1,"This course enables students to develop an understanding of mathematical concepts related to algebra, analytic geometry, and measurement and geometry through investigation, the effective use of technology, and abstract reasoning. Students will investigate relationships, which they will then generalize as equations of lines, and will determine the connections between different representations of a linear relation. They will also explore relationships that emerge from the measurement of three-dimensional figures and two-dimensional shapes. Students will reason mathematically and communicate their thinking as they solve multi-step problems.","A. Number Sense and Algebra
By the end of this course, students will:
• demonstrate an understanding of the exponent rules of multiplication and division, and apply them to simplify expressions;
• manipulate numerical and polynomial expressions, and solve first-degree equations.
B. Linear Relations
By the end of this course, students will:
• apply data-management techniques to investigate relationships between two variables;
• demonstrate an understanding of the characteristics of a linear relation;
• connect various representations of a linear relation.
C. Analytic Geometry
By the end of this course, students will:
• determine the relationship between the form of an equation and the shape of its graph with respect to linearity and non-linearity;
• determine, through investigation, the properties of the slope and y-intercept of a linear relation;
• solve problems involving linear relations.
D. Measurement and Geometry
By the end of this course, students will:
• determine, through investigation, the optimal values of various measurements;
• solve problems involving the measurements of two-dimensional shapes and the surface areas and volumes of three-dimensional figures;
• verify, through investigation facilitated by dynamic geometry software, geometric properties and relationships involving two-dimensional shapes, and apply the results to solving problems.
","{""term"":70,""final"":30,""categories"":{""Knowledge and Understanding"":25,""Thinking"":25,""Communication"":25,""Application"":25}}","[{""unitNum"":1,""unitDescription"":""Number Sense and Algebra"",""unitHours"":27},{""unitNum"":2,""unitDescription"":""Linear Relations"",""unitHours"":27},{""unitNum"":3,""unitDescription"":""Analytic Geometry"",""unitHours"":27},{""unitNum"":4,""unitDescription"":""Measurement and Geometry"",""unitHours"":27}]","[{""description"":""ISU"",""hours"":""0""},{""description"":""Exam"",""hours"":""2""}]",110,MPM1D,None,
Core French,9,Academic,1,"This course provides opportunities for students to communicate and interact in French with increasing independence, with a focus on familiar topics related to their daily lives. Students will develop their skills in listening, speaking, reading, and writing by using language learning strategies introduced in the elementary Core French program, and will apply creative and critical thinking skills in various ways. They will also enhance their understanding and appreciation of diverse French-speaking communities, and will develop skills necessary for lifelong language learning.","A. Listening
By the end of this course, students will:
• A1. Listening to Understand: determine meaning in a variety of authentic and adapted oral French texts, using a range of listening strategies;
• A2. Listening to Interact: interpret messages accurately while interacting in French for a variety of purposes and with diverse audiences;
• A3. Intercultural Understanding: demonstrate an understanding of information in oral French texts about aspects of culture in diverse French-speaking communities and other communities around the world, and of French sociolinguistic conventions used in a variety of situations and communities.

B. Speaking
By the end of this course, students will:
• B1. Speaking to Communicate: communicate information and ideas orally in French, using a variety of speaking strategies, appropriate language structures, and language appropriate to the purpose and audience;
• B2. Speaking to Interact: participate in spoken interactions in French for a variety of purposes and with diverse audiences;
• B3. Intercultural Understanding: in their spoken communications, demonstrate an awareness of aspects of culture in diverse French-speaking communities and other communities around the world, and of the appropriate use of French sociolinguistic conventions in a variety of situations.

C. Reading
By the end of this course, students will:
• C1. Reading Comprehension: determine meaning in a variety of authentic and adapted French texts, using a range of reading comprehension strategies;
• C2. Purpose, Form, and Style: identify the purpose(s), characteristics, and aspects of style of a variety of authentic and adapted text forms in French, including fictional, informational, graphic, and media forms;
• C3. Intercultural Understanding: demonstrate an understanding of information in French texts about aspects of culture in diverse French-speaking communities and other communities around the world, and of French sociolinguistic conventions used in a variety of situations and communities.

D. Writing
By the end of this course, students will:
• D1. Purpose, Audience, and Form: write French texts for different purposes and audiences, using a variety of forms and knowledge of language structures and conventions of written French appropriate for this level;
• D2. The Writing Process: use the stages of the writing process – including pre-writing, producing drafts, revising, editing, and publishing – to develop and organize content, clarify ideas and expression, correct errors, and present their work effectively;
• D3. Intercultural Understanding: in their written work, demonstrate an awareness of aspects of culture in diverse French-speaking communities and other communities around the world, and of the appropriate use of French sociolinguistic conventions in a variety of situations.","{""term"":70,""final"":30,""categories"":{""Knowledge and Understanding"":25,""Thinking"":25,""Communication"":25,""Application"":25}}","[{""unitNum"":1,""unitDescription"":""Listening"",""unitHours"":27},{""unitNum"":2,""unitDescription"":""Speaking"",""unitHours"":27},{""unitNum"":3,""unitDescription"":""Reading"",""unitHours"":27},{""unitNum"":4,""unitDescription"":""Writing"",""unitHours"":27}]","[{""description"":""Independent Study Unit"",""hours"":""8""},{""description"":""Final Exam"",""hours"":""2""}]",110,FSF1D,None,
Issues in Canadian Geography,9,Academic,1,"This course examines interrelationships within and between Canada’s natural and human systems and how these systems interconnect with those in other parts of the world. Students will explore environmental, economic, and social geographic issues relating to topics such as transportation options, energy choices, and urban development. Students will apply the concepts of geographic thinking and the geographic inquiry process, including spatial technologies, to investigate various geographic issues and to develop possible approaches for making Canada a more sustainable place in which to live.","A. Geographic Inquiry and Skill Development
Throughout this course, students will:
• A1. Geographic Inquiry: use the geographic inquiry process and the concepts of geographic thinking when investigating issues relating to Canadian geography;
• A2. Developing Transferable Skills: apply in everyday contexts skills, including spatial technology skills, developed through the investigation of Canadian geography, and identify some careers in which a background in geography might be an asset.

B. Interactions in the Physical Environment
By the end of this course, students will:
• B1. The Physical Environment and Human Activities: analyse various interactions between physical processes, phenomena, and events and human activities in Canada (FOCUS ON: Interrelationships; Geographic Perspective)
• B2. Interrelationships between Physical Systems, Processes, and Events: analyse characteristics of various physical processes, phenomena, and events affecting Canada and their interrelationship with global physical systems (FOCUS ON: Patterns and Trends; Interrelationships)
• B3. The Characteristics of Canada’s Natural Environment: describe various characteristics of the natural environment and the spatial distribution of physical features in Canada, and explain the role of physical processes, phenomena, and events in shaping them (FOCUS ON: Spatial Significance; Patterns and Trends)

C. Managing Canada’s Resources and Industries
By the end of this course, students will:
• C1. The Sustainability of Resources: analyse impacts of resource policy, resource management, and consumer choices on resource sustainability in Canada (FOCUS ON: Interrelationships; Geographic Perspective)
• C2. The Development of Resources: analyse issues related to the distribution, availability, and development of natural resources in Canada from a geographic perspective (FOCUS ON: Interrelationships; Geographic Perspective)
• C3. Industries and Economic Development: assess the relative importance of different industrial sectors to the Canadian economy and Canada’s place in the global economy, and analyse factors that influence the location of industries in these sectors (FOCUS ON: Spatial Significance; Patterns and Trends)

D. Changing Populations
By the end of this course, students will:
• D1. Population Issues: analyse selected national and global population issues and their implications for Canada (FOCUS ON: Interrelationships; Patterns and Trends)
• D2. Immigration and Cultural Diversity: describe the diversity of Canada’s population, and assess some social, economic, political, and environmental implications of immigration and diversity for Canada (FOCUS ON: Spatial Significance; Geographic Perspective)
• D3. Demographic Patterns and Trends: analyse patterns of population settlement and various demographic characteristics of the Canadian population (FOCUS ON: Spatial Significance; Patterns and Trends)","{""term"":70,""final"":30,""categories"":{""Knowledge and Understanding"":25,""Thinking"":25,""Communication"":25,""Application"":25}}","[{""unitNum"":1,""unitDescription"":""Interactions in the Physical Environment"",""unitHours"":27},{""unitNum"":2,""unitDescription"":""Managing Canada’s Resources and Industries"",""unitHours"":27},{""unitNum"":3,""unitDescription"":""Changing Populations"",""unitHours"":27},{""unitNum"":4,""unitDescription"":""Livable Communities"",""unitHours"":27}]","[{""description"":""Independent Study Unit"",""hours"":""8""},{""description"":""Final Exam"",""hours"":""2""}]",110,CGC1D,None,
